{
  "$schema": "https://json-schema.org/draft/2020-12/schema",
  "$id": "urn:penny:orchestration:artifacts:input-artifacts:1",
  "title": "Directive input_artifacts v1",
  "type": "object",
  "additionalProperties": false,
  "required": ["schema_version", "run_id", "consumer", "artifacts"],
  "properties": {
    "schema_version": { "const": 1 },
    "run_id": { "type": "string", "minLength": 1 },
    "consumer": { "type": "string", "minLength": 1 },
    "artifacts": {
      "type": "array",
      "items": {
        "type": "object",
        "additionalProperties": false,
        "required": ["slot", "ref"],
        "properties": {
          "slot": { "type": "string", "minLength": 1 },
          "ref": { "$ref": "urn:penny:orchestration:artifacts:artifact-ref:1" }
        }
      }
    }
  }
}
