{
  "schema_version": 1,
  "run_id": "run-1",
  "consumer": "state:synthesizing",
  "artifacts": [
    {
      "slot": "observations",
      "ref": {
        "schema_version": 1,
        "artifact_id": "art_aecc9e8a5d7e711c58ae2dda9d5b7a8673ba77bc93414d65f48ad17c8d85e927",
        "run_id": "run-1",
        "phase": "observing",
        "branch_id": null,
        "kind": "agent-output",
        "operation_id": "observe-1",
        "version": 1,
        "producer": "agent:echo",
        "consumer_scope": ["state:synthesizing"],
        "media_type": "text/markdown; charset=utf-8",
        "byte_length": 25,
        "content_digest": "ffa37b1d5689c333201d810e76707c38fbabbe8f1a616a5e16e94ae78db50c14",
        "store_ref": "artifact://sha256/ffa37b1d5689c333201d810e76707c38fbabbe8f1a616a5e16e94ae78db50c14"
      }
    }
  ]
}
